unique_cod,pessoa_unique_cod,profissional_unique_cod,descricao,privado,data_registro,prontuario_especialidade_cod,inclusor_unique_cod
1,100,100,3 episódios de infarto,true,2020-11-27 18:59:04.000,18,100
2,200,200,Possui síndrome do ovário policístico,,2023-01-28 18:59:04.000,18,200
3,300,300,Já fez um ciclo de Roacutan (4 meses),,2019-06-25 10:23:37.384,19,100
4,400,400,Histórico familiar de hipertensão,,2021-04-12 08:05:00.000,19,400
5,500,500,Cirurgia bariátrica em 2020,true,2022-08-03 09:45:00.000,18,500
